platform,handle_or_username,url,business_email,status,notes
OnlyFans,reddlacee,https://onlyfans.com/reddlacee,Teeedoggg2908@gmail.com,active,Primary subscription platform
OnlyFans,toxicccteeetv,https://onlyfans.com/toxicccteeetv,crimsoncollabs@icloud.com,active,Secondary/legacy profile naming found
TikTok,@redddlaceee,https://tiktok.com/@redddlaceee,crimsoncollabs@icloud.com,active,Use strict SFW funnel content
Instagram,,https://instagram.com,crimsoncollabs@icloud.com,active,Keep profile link hub updated
X/Twitter,,https://x.com,crimsoncollabs@icloud.com,active,Promotion and traffic routing
Facebook,,https://facebook.com,crimsoncollabs@icloud.com,active,Low-intensity awareness channel
Snapchat,,https://snapchat.com,Tinamichelle2908@gmail.com,active,Private fan nurture channel
ManyVids,toxicTeeTV,https://www.manyvids.com/,Crimsoncollabs@icloud.com,active,Cross-platform monetization
Fanslee,,https://fanslee.com,Teeedoggg2908@gmail.com,pending,Complete onboarding and link routing
AllMyLinks,,https://allmylinks.com,Teeedoggg2908@gmail.com,pending,Can be replaced by branded link hub
Linktree,redlaced.com,https://linktr.ee/,crimsoncollabs@icloud.com,pending,Set branded vanity naming
Reddit,,https://reddit.com,crimsoncollabs@icloud.com,pending,Community and teaser distribution
Pornhub,,https://pornhub.com,crimsoncollabs@icloud.com,pending,Optional channel based on compliance comfort
Chaturbate,,https://chaturbate.com,Teeedoggg2908@gmail.com,pending,Use only if stream workflow is ready
Kik,teeedoggg2908@gmail.com,https://kik.com,teeedoggg2908@gmail.com,pending,Treat as optional support inbox
